{
  "artifact_manifest": "artifacts.json",
  "ended_at": "2026-10-27T07:28:22.521045Z",
  "environment": {
    "environment_variables": {},
    "machine": "AMD64",
    "platform": "Windows-10-10.0.26200-SP0",
    "processor": "Intel64 Family 6 Model 183 Stepping 1, GenuineIntel",
    "python": "3.11.9 (tags/v3.11.9:de54cf5, Apr  2 2024, 10:12:12) [MSC v.1938 64 bit (AMD64)]",
    "release": "10",
    "system": "Windows"
  },
  "expected_logical_trials": 35,
  "experiment_id": "geometry-local-encoding-v1",
  "experiment_manifest_sha256": "53756ae112c9cf892ae0b809f57138fb4309bd6d3ea86fd8f3786ae07cba788e",
  "notes": "Run from a clean exact commit. The script emits per-terrain measurements to each trial artifact directory.",
  "publishable": true,
  "run_id": "geometry-local-encoding-v1:20261027T072802Z:53756ae112",
  "scenario": {
    "scenario_id": "geometry.local-encoding-synthetic.v1",
    "sha256": "7b8e40801c75af4e1b033753d177170181c49d2089fb9b2571df3494e6b90a8c"
  },
  "schema_version": "experiment.run.v1",
  "source_revision": {
    "commit": "0c0558f651acd2d2905a3658b11677fcfda8902e",
    "dirty": false,
    "dirty_entry_count": 0,
    "vcs": "git"
  },
  "started_at": "2026-10-27T07:28:02.583830Z",
  "status": "completed",
  "summary": {
    "attempt_status_counts": {
      "completed": 35
    },
    "final_trial_status_counts": {
      "completed": 35
    },
    "logical_trial_count": 35
  },
  "trials": [
    {
      "artifacts": [
        {
          "path": "stderr.log",
          "sha256": "e3b0c44298fc1c149afbf4c8996fb92427ae41e4649b934ca495991b7852b855",
          "size_bytes": 0
        },
        {
          "path": "stdout.log",
          "sha256": "0a00ee7cda5f68de0ab37631116ded8f87693ecff3c48f4a2b25edb8ebde5ec2",
          "size_bytes": 181
        },
        {
          "path": "terrain-encoding.json",
          "sha256": "445010e08e271ecb778c00fe407e6f8616aacbf3e098681be930f0c75dc8f2eb",
          "size_bytes": 4869
        }
      ],
      "attempt": 0,
      "command": {
        "arguments": [
          "scripts/benchmark_terrain_encodings.py"
        ],
        "executable": "{python}"
      },
      "duration_seconds": 0.61,
      "ended_at": "2026-10-27T07:28:03.199928Z",
      "exit_code": 0,
      "launch_error": null,
      "repetition_index": 0,
      "seed": 101,
      "started_at": "2026-10-27T07:28:02.590117Z",
      "status": "completed",
      "timeout_seconds": 120.0,
      "trial_id": "dense--seed-101--r0--a0",
      "variant_id": "dense",
      "working_directory": "."
    },
    {
      "artifacts": [
        {
          "path": "stderr.log",
          "sha256": "e3b0c44298fc1c149afbf4c8996fb92427ae41e4649b934ca495991b7852b855",
          "size_bytes": 0
        },
        {
          "path": "stdout.log",
          "sha256": "f7b4c9dc3bd5a6222dccd6c02e56f6f6d15324e75ce8e8a83e1f2b7923460503",
          "size_bytes": 180
        },
        {
          "path": "terrain-encoding.json",
          "sha256": "0baa4253a6fe8f2b12a39cff0c585ed6cc9ec2cb8aede53602bc5c98757214b2",
          "size_bytes": 4883
        }
      ],
      "attempt": 0,
      "command": {
        "arguments": [
          "scripts/benchmark_terrain_encodings.py"
        ],
        "executable": "{python}"
      },
      "duration_seconds": 0.609,
      "ended_at": "2026-10-27T07:28:03.819795Z",
      "exit_code": 0,
      "launch_error": null,
      "repetition_index": 0,
      "seed": 202,
      "started_at": "2026-10-27T07:28:03.210140Z",
      "status": "completed",
      "timeout_seconds": 120.0,
      "trial_id": "dense--seed-202--r0--a0",
      "variant_id": "dense",
      "working_directory": "."
    },
    {
      "artifacts": [
        {
          "path": "stderr.log",
          "sha256": "e3b0c44298fc1c149afbf4c8996fb92427ae41e4649b934ca495991b7852b855",
          "size_bytes": 0
        },
        {
          "path": "stdout.log",
          "sha256": "1d2a6120bee7ecdf5380c996a18427a2b4f8cb0841461e805058aa843b6bee5c",
          "size_bytes": 172
        },
        {
          "path": "terrain-encoding.json",
          "sha256": "5fe85a0fa634ef9074652306387a3af9b330a9171aa4dc524c3688823d30e2ab",
          "size_bytes": 4869
        }
      ],
      "attempt": 0,
      "command": {
        "arguments": [
          "scripts/benchmark_terrain_encodings.py"
        ],
        "executable": "{python}"
      },
      "duration_seconds": 0.515,
      "ended_at": "2026-10-27T07:28:04.343790Z",
      "exit_code": 0,
      "launch_error": null,
      "repetition_index": 0,
      "seed": 303,
      "started_at": "2026-10-27T07:28:03.833591Z",
      "status": "completed",
      "timeout_seconds": 120.0,
      "trial_id": "dense--seed-303--r0--a0",
      "variant_id": "dense",
      "working_directory": "."
    },
    {
      "artifacts": [
        {
          "path": "stderr.log",
          "sha256": "e3b0c44298fc1c149afbf4c8996fb92427ae41e4649b934ca495991b7852b855",
          "size_bytes": 0
        },
        {
          "path": "stdout.log",
          "sha256": "ddf001e6baa6f9414698f8bd45d04d3c4b81176ee0d9277bd02bcce5ad6df5ac",
          "size_bytes": 174
        },
        {
          "path": "terrain-encoding.json",
          "sha256": "6e7e9747218b8958ebf0579b5fe8f31334b03ee0b458806069f4b4f20a6d3091",
          "size_bytes": 4881
        }
      ],
      "attempt": 0,
      "command": {
        "arguments": [
          "scripts/benchmark_terrain_encodings.py"
        ],
        "executable": "{python}"
      },
      "duration_seconds": 0.563,
      "ended_at": "2026-10-27T07:28:04.912693Z",
      "exit_code": 0,
      "launch_error": null,
      "repetition_index": 0,
      "seed": 404,
      "started_at": "2026-10-27T07:28:04.353668Z",
      "status": "completed",
      "timeout_seconds": 120.0,
      "trial_id": "dense--seed-404--r0--a0",
      "variant_id": "dense",
      "working_directory": "."
    },
    {
      "artifacts": [
        {
          "path": "stderr.log",
          "sha256": "e3b0c44298fc1c149afbf4c8996fb92427ae41e4649b934ca495991b7852b855",
          "size_bytes": 0
        },
        {
          "path": "stdout.log",
          "sha256": "68f78fb5a8d2a7da827e19c018eaabad3ac0049b8fb0d7116efd46a85fbbc477",
          "size_bytes": 177
        },
        {
          "path": "terrain-encoding.json",
          "sha256": "855eac0ab996ccfb5c1a37f3b949c1f82ad590ec8e552bc3975341f5ea06edc8",
          "size_bytes": 4884
        }
      ],
      "attempt": 0,
      "command": {
        "arguments": [
          "scripts/benchmark_terrain_encodings.py"
        ],
        "executable": "{python}"
      },
      "duration_seconds": 0.562,
      "ended_at": "2026-10-27T07:28:05.488187Z",
      "exit_code": 0,
      "launch_error": null,
      "repetition_index": 0,
      "seed": 505,
      "started_at": "2026-10-27T07:28:04.929933Z",
      "status": "completed",
      "timeout_seconds": 120.0,
      "trial_id": "dense--seed-505--r0--a0",
      "variant_id": "dense",
      "working_directory": "."
    },
    {
      "artifacts": [
        {
          "path": "stderr.log",
          "sha256": "e3b0c44298fc1c149afbf4c8996fb92427ae41e4649b934ca495991b7852b855",
          "size_bytes": 0
        },
        {
          "path": "stdout.log",
          "sha256": "ec1d217a6663257caff3bbe524d2549f5a690606d7b2e03538f9ecfdb20b43e1",
          "size_bytes": 182
        },
        {
          "path": "terrain-encoding.json",
          "sha256": "2b2f439bb0f51478533b8076547a81ecda7b94ab503743568a3e5c903f532e67",
          "size_bytes": 4869
        }
      ],
      "attempt": 0,
      "command": {
        "arguments": [
          "scripts/benchmark_terrain_encodings.py"
        ],
        "executable": "{python}"
      },
      "duration_seconds": 0.5,
      "ended_at": "2026-10-27T07:28:06.000607Z",
      "exit_code": 0,
      "launch_error": null,
      "repetition_index": 0,
      "seed": 101,
      "started_at": "2026-10-27T07:28:05.495269Z",
      "status": "completed",
      "timeout_seconds": 120.0,
      "trial_id": "sparse--seed-101--r0--a0",
      "variant_id": "sparse",
      "working_directory": "."
    },
    {
      "artifacts": [
        {
          "path": "stderr.log",
          "sha256": "e3b0c44298fc1c149afbf4c8996fb92427ae41e4649b934ca495991b7852b855",
          "size_bytes": 0
        },
        {
          "path": "stdout.log",
          "sha256": "a205a31897aad480b6f4ae3564556a2ee1e07d73ee704b005283e1ca80250d2e",
          "size_bytes": 179
        },
        {
          "path": "terrain-encoding.json",
          "sha256": "4857fd452d4d8ab0bed557f9b5814136d0ed7fc89e680a388c67e219a0fd1f13",
          "size_bytes": 4882
        }
      ],
      "attempt": 0,
      "command": {
        "arguments": [
          "scripts/benchmark_terrain_encodings.py"
        ],
        "executable": "{python}"
      },
      "duration_seconds": 0.532,
      "ended_at": "2026-10-27T07:28:06.555189Z",
      "exit_code": 0,
      "launch_error": null,
      "repetition_index": 0,
      "seed": 202,
      "started_at": "2026-10-27T07:28:06.015925Z",
      "status": "completed",
      "timeout_seconds": 120.0,
      "trial_id": "sparse--seed-202--r0--a0",
      "variant_id": "sparse",
      "working_directory": "."
    },
    {
      "artifacts": [
        {
          "path": "stderr.log",
          "sha256": "e3b0c44298fc1c149afbf4c8996fb92427ae41e4649b934ca495991b7852b855",
          "size_bytes": 0
        },
        {
          "path": "stdout.log",
          "sha256": "805dba4199745f26e0c34d1cf4c3491dcd466199c9a0f01dbf73a2058a3a49b4",
          "size_bytes": 179
        },
        {
          "path": "terrain-encoding.json",
          "sha256": "81a43b3a149a51a4e3665168ba04942dd6e34695e4881a1b66216045d76765b8",
          "size_bytes": 4869
        }
      ],
      "attempt": 0,
      "command": {
        "arguments": [
          "scripts/benchmark_terrain_encodings.py"
        ],